{
  "specVersion": 1,
  "lessonTitle": "Turn fold to second barrel",
  "players": 2,
  "playersInfo": [
    { "seat": 1, "position": "BB", "name": "Aggressor" },
    { "seat": 2, "position": "BTN", "name": "Hero" }
  ],
  "heroSeat": 2,
  "blinds": { "sb": 0.5, "bb": 1 },
  "startingStacksBB": 100,
  "heroHoleCards": ["Tc", "9c"],
  "board": ["Kh", "Qd", "4s", "Jc"],
  "actions": [
    { "street": "PREFLOP", "actorSeat": 2, "action": "RAISE", "sizeBB": 2.5 },
    { "street": "PREFLOP", "actorSeat": 1, "action": "CALL" },
    { "street": "FLOP", "actorSeat": 1, "action": "BET", "sizePot": 0.5 },
    { "street": "FLOP", "actorSeat": 2, "action": "CALL" },
    { "street": "TURN", "actorSeat": 1, "action": "BET", "sizePot": 0.75 },
    { "street": "TURN", "actorSeat": 2, "action": "FOLD" }
  ],
  "tags": ["turn", "fold", "double-barrel"],
  "constraints": { "minStreetReached": "TURN", "minHeroDecisions": 2 }
}
