{
  "specVersion": 1,
  "lessonTitle": "River call for value",
  "players": 2,
  "playersInfo": [
    { "seat": 1, "position": "BB", "name": "Value-better" },
    { "seat": 2, "position": "BTN", "name": "Hero" }
  ],
  "heroSeat": 2,
  "blinds": { "sb": 0.5, "bb": 1 },
  "startingStacksBB": 100,
  "heroHoleCards": ["Jc", "Jd"],
  "board": ["Jh", "8s", "3c", "Ah", "2d"],
  "actions": [
    { "street": "PREFLOP", "actorSeat": 2, "action": "RAISE", "sizeBB": 2.5 },
    { "street": "PREFLOP", "actorSeat": 1, "action": "CALL" },
    { "street": "FLOP", "actorSeat": 1, "action": "CHECK" },
    { "street": "FLOP", "actorSeat": 2, "action": "BET", "sizeBB": 3 },
    { "street": "FLOP", "actorSeat": 1, "action": "CALL" },
    { "street": "TURN", "actorSeat": 1, "action": "CHECK" },
    { "street": "TURN", "actorSeat": 2, "action": "BET", "sizePot": 0.75 },
    { "street": "TURN", "actorSeat": 1, "action": "CALL" },
    { "street": "RIVER", "actorSeat": 1, "action": "BET", "sizePot": 0.5 },
    { "street": "RIVER", "actorSeat": 2, "action": "CALL" }
  ],
  "tags": ["river", "call", "value"],
  "constraints": { "minStreetReached": "RIVER", "minHeroDecisions": 3 }
}
