{
  "specVersion": 1,
  "lessonTitle": "Flop check back",
  "players": 2,
  "playersInfo": [
    { "seat": 1, "position": "BB", "name": "Opponent" },
    { "seat": 2, "position": "BTN", "name": "Hero" }
  ],
  "heroSeat": 2,
  "blinds": { "sb": 0.5, "bb": 1 },
  "startingStacksBB": 100,
  "heroHoleCards": ["Ah", "Kd"],
  "board": ["2c", "7s", "9d", "Th", "3c"],
  "actions": [
    { "street": "PREFLOP", "actorSeat": 2, "action": "RAISE", "sizeBB": 2.5 },
    { "street": "PREFLOP", "actorSeat": 1, "action": "CALL" },
    { "street": "FLOP", "actorSeat": 1, "action": "CHECK" },
    { "street": "FLOP", "actorSeat": 2, "action": "CHECK" },
    { "street": "TURN", "actorSeat": 1, "action": "BET", "sizePot": 0.5 },
    { "street": "TURN", "actorSeat": 2, "action": "CALL" },
    { "street": "RIVER", "actorSeat": 1, "action": "CHECK" },
    { "street": "RIVER", "actorSeat": 2, "action": "CHECK" }
  ],
  "tags": ["check", "flop", "multi-street"],
  "constraints": { "minStreetReached": "RIVER", "minHeroDecisions": 3 }
}
