{
  "specVersion": 1,
  "lessonTitle": "Flop check-raise bluff",
  "players": 2,
  "playersInfo": [
    { "seat": 1, "position": "BB", "name": "C-bettor" },
    { "seat": 2, "position": "BTN", "name": "Hero" }
  ],
  "heroSeat": 2,
  "blinds": { "sb": 0.5, "bb": 1 },
  "startingStacksBB": 100,
  "heroHoleCards": ["Ah", "5h"],
  "board": ["Kh", "Qc", "Js", "3d", "2s"],
  "actions": [
    { "street": "PREFLOP", "actorSeat": 2, "action": "RAISE", "sizeBB": 2.5 },
    { "street": "PREFLOP", "actorSeat": 1, "action": "CALL" },
    { "street": "FLOP", "actorSeat": 1, "action": "CHECK" },
    { "street": "FLOP", "actorSeat": 2, "action": "BET", "sizePot": 0.5 },
    { "street": "FLOP", "actorSeat": 1, "action": "RAISE", "sizePot": 2 },
    { "street": "FLOP", "actorSeat": 2, "action": "FOLD" }
  ],
  "tags": ["check-raise", "flop", "bluff"],
  "constraints": { "minHeroDecisions": 2 }
}
